_id/$oid,nombre,categoria,marca,presentacion,id
5cbc69be7af152186c0cd784,Aceite de Girasol Cañuelas 1.5 Lt,Aceite,CAÑUELAS,1.5 lt,7792180001665
5cbc69be7af152186c0cd783,Aceite de Girasol Cañuelas 900 Cc,Aceite,CAÑUELAS,900.0 cc,7792180001641
5cbc69be7af152186c0cd54d,Aceite de Girasol Cocinero 1.5 Lt,Aceite,COCINERO,1.5 lt,7790060023684
5cbc69be7af152186c0cd552,Aceite de Girasol Cocinero 900 Ml,Aceite,COCINERO,900.0 ml,7790070012050
5cbc69be7af152186c0cd5e4,Aceite de Girasol Natura 1.5 Lt,Aceite,NATURA,1.5 lt,7790272001029
5cbc69be7af152186c0cd5e5,Aceite de Girasol Natura 500 Ml,Aceite,NATURA,500.0 ml,7790272001050
5cbc69be7af152186c0cd5e3,Aceite de Girasol Natura 900 Ml,Aceite,NATURA,900.0 ml,7790272001005
5cbc69be7af152186c0cd5e0,Aceite de Maiz Mazola 900 Ml,Aceite,MAZOLA,900.0 ml,7790272000794
5cbc69be7af152186c0cd5df,Aceite Mezcla Girasol y Oliva Blend Natura 900 Ml,Aceite,NATURA,900.0 ml,7790272000046
5cbc69be7af152186c0cd55b,Aceite Rocio Vegetal Clasico Aerosol Cocinero 120 Gr,Aceite,COCINERO,120.0 gr,7790070228666
5cbc69be7af152186c0cd5e1,Aceite Rocio Vegetal Girasol en Aerosol Natura 120 Cc,Aceite,NATURA,126.0 cc,7790272000831
5cbc69be7af152186c0cd54c,Aceite de Oliva Comestible Cocinero 500 Ml,Aceite de oliva,COCINERO,500.0 ml,7790060009329
5cbc69be7af152186c0cd5e2,Aceite de Oliva Extra Virgen Seleccion Especial Natura 500 Ml,Aceite de oliva,NATURA,500.0 ml,7790272000961
5cbc69be7af152186c0cd813,Ketchup con Tomate Hellmanns 250 Gr,Aderezos,HELLMANN'S,250.0 gr,7794000960275
5cbc69be7af152186c0cd812,Ketchup con Tomate Hellmanns 500 Gr,Aderezos,HELLMANN'S,500.0 gr,7794000960244
5cbc69be7af152186c0cd76e,Ketchup Natura 250 Gr,Aderezos,NATURA,250.0 gr,7791866000381
5cbc69be7af152186c0cd772,Mayonesa con Aceite de Oliva Mayoliva 227 Gr,Aderezos,MAYOLIVA,237.0 gr,7791866003283
5cbc69be7af152186c0cd80f,Mayonesa Doypack Hellmann's 237 Gr,Aderezos,HELLMANN'S,237.0 gr,7794000960107
5cbc69be7af152186c0cd80e,Mayonesa Doypack Hellmann's 475 Gr,Aderezos,HELLMANN'S,475.0 gr,7794000960091
5cbc69be7af152186c0cd76f,Mayonesa Doypack Natura 237 Gr,Aderezos,NATURA,237.0 gr,7791866001203
5cbc69be7af152186c0cd771,Mayonesa Doypack Natura 500 Ml,Aderezos,NATURA,500.0 ml,7791866001364
5cbc69be7af152186c0cd770,Mayonesa Doypack Natura 950 Gr,Aderezos,NATURA,950.0 gr,7791866001357
5cbc69be7af152186c0cd7d0,Mayonesa Light Doypack BC La Campagnola 500 Gr,Aderezos,BC,475.0 gr,7793360674105
5cbc69be7af152186c0cd811,Mayonesa Light Doypack Hellmanns 237 Gr,Aderezos,HELLMANN'S,237.0 gr,7794000960145
5cbc69be7af152186c0cd810,Mayonesa Light Doypack Hellmanns 475 Gr,Aderezos,HELLMANN'S,475.0 gr,7794000960138
5cbc69be7af152186c0cd773,Mostaza Doypack Natura 250 Gr,Aderezos,NATURA,250.0 gr,7791866004211
5cbc69be7af152186c0cd815,Mostaza Original Doypack Savora 250 Gr,Aderezos,SAVORA,250.0 gr,7794000960435
5cbc69be7af152186c0cd814,Salsa Golf sin TACC Hellmanns 250 Gr,Aderezos,HELLMANN'S,250.0 gr,7794000960329
5cbc69be7af152186c0cd5b0,Vinagre de Alcohol Menoyo 1 Lt,Aderezos,MENOYO,1.0 lt,7790130000058
5cbc69be7af152186c0cd5af,Vinagre de Alcohol Menoyo 500 Cc,Aderezos,MENOYO,500.0 cc,7790130000034
5cbc69be7af152186c0cd5ae,Vinagre de Manzana Menoyo 500 Cc,Aderezos,MENOYO,500.0 cc,7790130000027
5cbc69be7af152186c0cd5b1,Vinagre de Vino Menoyo 500 Cc,Aderezos,MENOYO,500.0 cc,7790130000065
5cbc69be7af152186c0cd83c,Agua Mineral con Gas Villavicencio 1.5 Lt,Agua,VILLAVICENCIO,1.5 lt,7798062547788
5cbc69be7af152186c0cd5f5,Agua Mineral sin Gas Bajo Sodio Ser 1.5 Lt,Agua,SER,1.5 lt,7790315058706
5cbc69be7af152186c0cd692,Agua Mineral sin Gas Bonaqua 1.5 Lt,Agua,BONAQUA,1.5 lt,7790895003875
5cbc69be7af152186c0cd691,Agua Mineral sin Gas Bonaqua 500 Cc,Agua,BONAQUA,500.0 cc,7790895003868
5cbc69be7af152186c0cd7a7,Agua Mineral sin Gas Eco de Los Andes 500 Cc,Agua,ECO DE LOS ANDES,500.0 cc,7792799000011
5cbc69be7af152186c0cd6a0,Agua Mineral sin Gas en Bidon Kin 6 Lt,Agua,KIN,6.0 lt,7790895009679
5cbc69be7af152186c0cd7a8,Agua Mineral sin Gas en Bidon Nestle 6.3 Lt,Agua,NESTLÉ,6.3 lt,7792799001032
5cbc69be7af152186c0cd837,Agua Mineral sin Gas en Bidon Villa del Sur 6.25 Lt,Agua,VILLA DEL SUR,6.25 lt,7798062541397
5cbc69be7af152186c0cd681,Agua Mineral sin Gas Kin 500 Cc,Agua,KIN,500.0 cc,7790895000201
5cbc69be7af152186c0cd83b,Agua Mineral sin Gas Villa del Sur 2.25 Lt,Agua,VILLA DEL SUR,2.25 lt,7798062547559
5cbc69be7af152186c0cd5ef,Agua Mineral sin Gas Villavicencio 1.5 Lt,Agua,VILLAVICENCIO,1.5 lt,7790315000439
5cbc69be7af152186c0cd5ee,Agua Mineral sin Gas Villavicencio 2 Lt,Agua,VILLAVICENCIO,2.0 lt,7790315000422
5cbc69be7af152186c0cd5f0,Agua Mineral sin Gas Villavicencio 500 Cc,Agua,VILLAVICENCIO,500.0 cc,7790315000446
5cbc69be7af152186c0cd7b5,Agua Mineralizada sin Gas Glaciar 1.5 Lt,Agua,GLACIAR,1.5 lt,7792931000022
5cbc69be7af152186c0cd7b6,Agua Mineralizada sin Gas Glaciar 2 Lt,Agua,GLACIAR,2.0 lt,7792931000039
5cbc69be7af152186c0cd586,Arroz Carnaroli Risotto Primavera Gallo 200 Gr,Arroz,GALLO,200.0 gr,7790070411761
5cbc69be7af152186c0cd584,Arroz Doble Carolina Gallo 1 Kg,Arroz,GALLO,1.0 kg,7790070411723
5cbc69be7af152186c0cd583,Arroz Gallo Oro 1 Kg,Arroz,GALLO,1.0 kg,7790070411716
5cbc69be7af152186c0cd6d5,Arroz Largo Fino 00000 en Bolsa Molinos Ala 1 Kg,Arroz,MOLINOS ALA,1.0 kg,7791120031557
5cbc69be7af152186c0cd57a,Arroz Largo Fino en Bolsa Lucchetti 1 Kg,Arroz,LUCCHETTI,1.0 kg,7790070410603
5cbc69be7af152186c0cd587,Arroz Parbolizado Lucchetti 1 Kg,Arroz,LUCCHETTI,1.0 kg,7790070411815
5cbc69be7af152186c0cd588,Arroz Parbolizado Lucchetti 500 Gr,Arroz,LUCCHETTI,500.0 gr,7790070411822
5cbc69be7af152186c0cd574,Vitina Lucchetti 540 Gr,Bebes y niños,VITINA,540.0 gr,7790070318879
5cbc69be7af152186c0cd824,Leche Infantil Nutrilon Profutura Premium 1 200 Ml,Bebes y niños,NUTRILÓN,200.0 ml,7795323002468
5cbc69be7af152186c0cd825,Leche Infantil Nutrilon Profutura Premium 2 200 Ml,Bebes y niños,NUTRILÓN,200.0 ml,7795323002475
5cbc69be7af152186c0cd826,Leche Infantil Nutrilon Profutura Premium 3 200 Ml,Bebes y niños,NUTRILÓN,200.0 ml,7795323002482
5cbc69be7af152186c0cd859,Leche Infantil Sancor Bebe 4 1 Lt,Bebes y niños,SANCOR,1.0 lt,7798176001077
5cbc69be7af152186c0cd854,Leche Infantil Sancor EnfaBebe Premium 2 200 Ml,Bebes y niños,SANCOR,200.0 ml,7798176000599
5cbc69be7af152186c0cd855,Leche Infantil UAT Larga Vida Nutricion Completa Sancor Bebe 1 200 Ml,Bebes y niños,SANCOR,200.0 ml,7798176000841
5cbc69be7af152186c0cd858,Leche Infantil UAT Larga Vida Nutricion Completa Sancor Bebe 1 500 Ml,Bebes y niños,SANCOR,500.0 ml,7798176000872
5cbc69be7af152186c0cd856,Leche Infantil UAT Larga Vida Nutricion Completa Sancor Bebe 2 200 Ml,Bebes y niños,SANCOR,200.0 ml,7798176000858
5cbc69be7af152186c0cd852,Leche Infantil UAT Larga Vida Nutricion Completa Sancor Bebe 3 1 Lt,Bebes y niños,SANCOR,1.0 lt,7798176000384
5cbc69be7af152186c0cd857,Leche Infantil UAT Larga Vida Nutricion Completa Sancor Bebe 3 200 Cc,Bebes y niños,SANCOR,200.0 cc,7798176000865
5cbc69be7af152186c0cd853,Leche Sancor EnfaBebe Premium 1 200 Ml,Bebes y niños,SANCOR,200.0 ml,7798176000582
5cbc69be7af152186c0cd81d,Pañal G Active Sec Huggies 24 Un,Bebes y niños,HUGGIES,24.0 un,7794626008832
5cbc69be7af152186c0cd4b5,Pañal G Confort Sec Pampers 22 Un,Bebes y niños,PAMPERS,22.0 un,7500435112758
5cbc69be7af152186c0cd4b4,Pañal M Confort Sec Pampers 26 Un,Bebes y niños,PAMPERS,26.0 un,7500435112741
5cbc69be7af152186c0cd4b3,Pañal P Confort Sec Pampers 30 Un,Bebes y niños,PAMPERS,30.0 un,7500435112734
5cbc69be7af152186c0cd4b6,Pañal XG Confort Sec Pampers 18 Un,Bebes y niños,PAMPERS,18.0 un,7500435112765
5cbc69be7af152186c0cd81a,Toallitas Humedas Clasico y Cotidiano Huggies 48 Un,Bebes y niños,HUGGIES,48.0 un,7794626007170
5cbc69be7af152186c0cd85d,Toallitas Humedas Extra Cuidado Johnsons Baby 96 Un,Bebes y niños,JOHNSON'S,96.0 un,7891010589615
5cbc69be7af152186c0cd81c,Toallitas Humedas Limpieza Humectante Huggies 48 Un,Bebes y niños,HUGGIES,48.0 un,7794626007248
5cbc69be7af152186c0cd81b,Toallitas Humedas Puro y Natural Huggies 48 Un,Bebes y niños,HUGGIES,48.0 un,7794626007217
5cbc69be7af152186c0cd851,Aperitivo Americano Cinzano Rosso 950 Ml,Bebidas con alcohol,CINZANO,950.0 ml,7798131200828
5cbc69be7af152186c0cd6bb,Aperitivo Americano Gancia 450 Cc,Bebidas con alcohol,GANCIA,450.0 cc,7790950000191
5cbc69be7af152186c0cd6ba,Aperitivo Americano Gancia 950 Cc,Bebidas con alcohol,GANCIA,950.0 cc,7790950000160
5cbc69be7af152186c0cd863,Aperitivo Bitter Campari 750 Ml,Bebidas con alcohol,CAMPARI,750.0 ml,7891136052000
5cbc69be7af152186c0cd79b,Aperitivo Granadina Cusenier 750 Ml,Bebidas con alcohol,CUSENIER,750.0 ml,7792410128803
5cbc69be7af152186c0cd6bc,Aperitivo Vodka Dr Lemon 1 Lt,Bebidas con alcohol,DR LEMON,1.0 lt,7790950131918
5cbc69be7af152186c0cd6c7,Aperitivo Vodka Dr Lemon 473 Cc,Bebidas con alcohol,DR LEMON,473.0 cc,7790950202823
5cbc69be7af152186c0cd7a1,Cerveza Negra Quilmes Stout 1 Lt,Bebidas con alcohol,QUILMES,1.0 lt,7792798007400
5cbc69be7af152186c0cd7a2,Cerveza Rubia Bajo Cero Quilmes 1 Lt,Bebidas con alcohol,QUILMES,1.0 lt,7792798007424
5cbc69be7af152186c0cd7a3,Cerveza Rubia Chopp Brahma 1 Lt,Bebidas con alcohol,BRAHMA,1.0 lt,7792798007493
5cbc69be7af152186c0cd486,Cerveza Rubia Corona 335 Cc,Bebidas con alcohol,CORONA,355.0 cc,75032715
5cbc69be7af152186c0cd7a0,Cerveza Rubia Cristal Quilmes 1 Lt,Bebidas con alcohol,QUILMES,1.0 lt,7792798007387
5cbc69be7af152186c0cd7a6,Cerveza Rubia en Lata Quilmes 473 Cc 6 Un,Bebidas con alcohol,QUILMES,473.0 cc,7792798012947
5cbc69be7af152186c0cd7c2,Cerveza Rubia en Lata Schneider 473 Cc,Bebidas con alcohol,SCHNEIDER,473.0 cc,7793147118860
5cbc69be7af152186c0cd7c3,Cerveza Rubia en Lata Schneider 473 Cc 6 Un,Bebidas con alcohol,SCHNEIDER,473.0 cc,7793147118884
5cbc69be7af152186c0cd79d,Cerveza Rubia Iguana 970 Cc,Bebidas con alcohol,IGUANA,970.0 cc,7792798000708
5cbc69be7af152186c0cd827,Cerveza Rubia Isenbeck 970 Cc,Bebidas con alcohol,ISENBECK,970.0 cc,7795697001708
5cbc69be7af152186c0cd7bf,Cerveza Rubia Lager Imperial 1 Lt,Bebidas con alcohol,IMPERIAL,1.0 lt,7793147000981
5cbc69be7af152186c0cd7c4,Cerveza Rubia Miller Genuine Draft 1 Lt,Bebidas con alcohol,MILLER,1.0 lt,7793147570088
5cbc69be7af152186c0cd79f,Cerveza Rubia Patagonia Amber Lager 740 Cc,Bebidas con alcohol,PATAGONIA,740.0 cc,7792798007158
5cbc69be7af152186c0cd7a4,Cerveza Rubia Quilmes 1890 1 Lt,Bebidas con alcohol,QUILMES,1.0 lt,7792798007738
5cbc69be7af152186c0cd7a5,Cerveza Rubia Quilmes Cristal 340 Cc,Bebidas con alcohol,QUILMES,330.0 cc,7792798011087
5cbc69be7af152186c0cd7c1,Cerveza Rubia Retornable Budweiser 1 Lt,Bebidas con alcohol,BUDWEISER,1.0 lt,7793147001056
5cbc69be7af152186c0cd7be,Cerveza Rubia Retornable Heineken 1 Lt,Bebidas con alcohol,HEINEKEN,1.0 lt,7793147000899
5cbc69be7af152186c0cd7c0,Cerveza Rubia Retornable Schneider 1 Lt,Bebidas con alcohol,SCHNEIDER,1.0 lt,7793147001025
5cbc69be7af152186c0cd79e,Cerveza Rubia Stella Artois 970 Cc,Bebidas con alcohol,STELLA ARTOIS,970.0 cc,7792798006199
5cbc69be7af152186c0cd5b2,Fernet 1882 750 Cc,Bebidas con alcohol,1882,750.0 cc,7790139002879
5cbc69be7af152186c0cd5e6,Fernet Branca 450 Cc,Bebidas con alcohol,BRANCA,450.0 cc,7790290001179
5cbc69be7af152186c0cd5e7,Fernet Branca 750 Cc,Bebidas con alcohol,BRANCA,750.0 cc,7790290001193
5cbc69be7af152186c0cd79a,Licor de Cafe al Cognac Cusenier 700 Cc,Bebidas con alcohol,CUSENIER,700.0 cc,7792410008365
5cbc69be7af152186c0cd799,Licor de Chocolate Cusenier 700 Cc,Bebidas con alcohol,CUSENIER,700.0 cc,7792410008105
5cbc69be7af152186c0cd6e0,Licor de Chocolate Premium Bols 700 Cc,Bebidas con alcohol,BOLS,700.0 cc,7791200000220
5cbc69be7af152186c0cd798,Licor de Huevo Cusenier 700 Cc,Bebidas con alcohol,CUSENIER,700.0 cc,7792410008051
5cbc69be7af152186c0cd49b,Ron Blanco Capitan Morgan 750 Ml,Bebidas con alcohol,CAPITÁN MORGAN,750.0 ml,5000281040356
5cbc69be7af152186c0cd7e1,Vino Blanco Chardonnay Benjamin 750 Ml,Bebidas con alcohol,BENJAMÍN,750.0 ml,7793440702926
5cbc69be7af152186c0cd6ce,Vino Blanco Chardonnay Latitud 33 750 Ml,Bebidas con alcohol,LATITUD 33,750.0 ml,7790975017471
5cbc69be7af152186c0cd761,Vino Blanco Chenin Dulce Natural Santa Julia 750 Ml,Bebidas con alcohol,SANTA JULIA,750.0 ml,7791728000115
5cbc69be7af152186c0cd65c,Vino Blanco Dulce Natural Suter 750 Ml,Bebidas con alcohol,SUTER,750.0 ml,7790704169563
5cbc69be7af152186c0cd5ce,Vino Blanco Dulce Natural Trapiche Cosecha Tardia 750 Ml,Bebidas con alcohol,BODEGA TRAPICHE,750.0 ml,7790240041880
5cbc69be7af152186c0cd753,Vino Blanco Hereford 750 Ml,Bebidas con alcohol,HEREFORD,750.0 ml,7791540035319
5cbc69be7af152186c0cd65a,Vino Blanco New Age 750 Ml,Bebidas con alcohol,NEW AGE,750.0 ml,7790703165207
5cbc69be7af152186c0cd840,Vino Blanco Sauvignon Blanc Finca El Portillo 750 Ml,Bebidas con alcohol,FINCA EL PORTILLO,750.0 cc,7798074860226
5cbc69be7af152186c0cd5cc,Vino Blanco Sauvignon Blanc Trapiche 750 Ml,Bebidas con alcohol,TRAPICHE,750.0 ml,7790240017069
5cbc69be7af152186c0cd5c4,Vino Blanco Seleccion Dorada Michel Torino 380 Ml,Bebidas con alcohol,MICHEL TORINO,380.0 ml,7790189041132
5cbc69be7af152186c0cd67d,Vino Blanco Seleccion Especial Santa Ana 700 Ml,Bebidas con alcohol,SANTA ANA,700.0 ml,7790762052357
5cbc69be7af152186c0cd6ca,Vino Blanco Semillon Chardonnay Castel 750 Ml,Bebidas con alcohol,CASTEL,750.0 ml,7790975000084
5cbc69be7af152186c0cd5ad,Vino Blanco Torrontes Etchart Privado 750 Ml,Bebidas con alcohol,ETCHART,750.0 ml,7790093132728
5cbc69be7af152186c0cd792,Vino Cosecha Tardia Norton 750 Ml,Bebidas con alcohol,NORTON,750.0 ml,7792319064073
5cbc69be7af152186c0cd757,Vino Espumante Blanco Frizze Classic 750 Ml,Bebidas con alcohol,FRIZEE,750.0 ml,7791540045011
5cbc69be7af152186c0cd754,Vino Espumante Blue Evolution Frizze 750 Ml,Bebidas con alcohol,FRIZEE,750.0 ml,7791540042706
5cbc69be7af152186c0cd6cc,Vino Espumante Demi Sec Chandon 750 Ml,Bebidas con alcohol,CHANDON,750.0 ml,7790975000190
5cbc69be7af152186c0cd6cb,Vino Espumante Extra Brut Chandon 750 Ml,Bebidas con alcohol,CHANDON,750.0 ml,7790975000183
5cbc69be7af152186c0cd6e6,Vino Espumante Navarro Correas 750 Cc,Bebidas con alcohol,NAVARRO CORREAS,750.0 cc,7791250001529
5cbc69be7af152186c0cd791,Vino Rosado Cosecha Tardia Norton 750 Cc,Bebidas con alcohol,NORTON,750.0 cc,7792319003072
5cbc69be7af152186c0cd7df,Vino Rosado Dulce Coleccion Tardia Benjamin 750 Ml,Bebidas con alcohol,BENJAMÍN,750.0 ml,7793440001104
5cbc69be7af152186c0cd67e,Vino Rosado Seleccion Especial Santa Ana 700 Ml,Bebidas con alcohol,SANTA ANA,700.0 ml,7790762052364
5cbc69be7af152186c0cd65b,Vino Tinto Borgoña Suter 750 Ml,Bebidas con alcohol,SUTER,750.0 cc,7790704167729
5cbc69be7af152186c0cd60c,Vino Tinto Borgoña Viñas de Alvear 1.125 Lt,Bebidas con alcohol,VIÑAS DE ALVEAR,1.125 lt,7790480000463
5cbc69be7af152186c0cd759,Vino Tinto Cabernet Dada Art 750 Cc,Bebidas con alcohol,DADA,750.0 cc,7791540047855
5cbc69be7af152186c0cd5ed,Vino Tinto Cabernet Malbec Estancia Mendoza 750 Ml,Bebidas con alcohol,ESTANCIA MENDOZA,750.0 ml,7790314056598
5cbc69be7af152186c0cd848,Vino Tinto Cabernet Sauvignion Aime 750 Cc,Bebidas con alcohol,AIMÉ,750.0 cc,7798090852526
5cbc69be7af152186c0cd5cf,Vino Tinto Cabernet Sauvignon Alma Mora 750 Ml,Bebidas con alcohol,ALMA MORA,750.0 ml,7790240042085
5cbc69be7af152186c0cd84c,Vino Tinto Cabernet Sauvignon Alta Callia 750 Cc,Bebidas con alcohol,CALLIA,750.0 cc,7798108830249
5cbc69be7af152186c0cd5bc,Vino Tinto Cabernet Sauvignon Colon 750 Cc,Bebidas con alcohol,COLON,750.0 cc,7790168000488
5cbc69be7af152186c0cd5c1,Vino Tinto Cabernet Sauvignon Elementos 750 Cc,Bebidas con alcohol,ELEMENTOS,750.0 cc,7790189021011
5cbc69be7af152186c0cd7e0,Vino Tinto Cabernet Sauvignon Emilia Nieto Senetiner 750 Cc,Bebidas con alcohol,NIETO SANETINER,750.0 cc,7793440002316
5cbc69be7af152186c0cd841,Vino Tinto Cabernet Sauvignon Finca El Portillo 750 Cc,Bebidas con alcohol,FINCA EL PORTILLO,750.0 cc,7798074860233
5cbc69be7af152186c0cd609,Vino Tinto Cabernet Sauvignon Finca Flichman 750 Cc,Bebidas con alcohol,FINCA FLICHMAN,750.0 cc,7790470005904
5cbc69be7af152186c0cd6cf,Vino Tinto Cabernet Sauvignon Latitud 33 750 Ml,Bebidas con alcohol,LATITUD 33,750.0 ml,7790975017495
5cbc69be7af152186c0cd6e2,Vino Tinto Cabernet Sauvignon Los Arboles 750 Ml,Bebidas con alcohol,LOS ÁRBOLES,750.0 ml,7791250000942
5cbc69be7af152186c0cd6cd,Vino Tinto Cabernet Sauvignon Malbec Pinot Noir Valmont 750 Ml,Bebidas con alcohol,VALMONT,750.0 ml,7790975000312
5cbc69be7af152186c0cd7e3,Vino Tinto Cabernet Sauvignon Nieto Senetiner Benjamin 750 Ml,Bebidas con alcohol,NIETO SANETINER,750.0 ml,7793440702964
5cbc69be7af152186c0cd5d2,Vino Tinto Cabernet Sauvignon Trapiche 750 Ml,Bebidas con alcohol,TRAPICHE,750.0 ml,7790240107500
5cbc69be7af152186c0cd793,Vino Tinto Clasico Bodega Norton 750 Cc,Bebidas con alcohol,NORTON,750.0 cc,7792319065254
5cbc69be7af152186c0cd790,Vino Tinto Cosecha Tardia Bodega Norton 750 Cc,Bebidas con alcohol,NORTON,750.0 cc,7792319002976
5cbc69be7af152186c0cd756,Vino Tinto Dada 3 Finca Las Moras 750 Ml,Bebidas con alcohol,FINCA LAS MORAS,750.0 ml,7791540044526
5cbc69be7af152186c0cd67b,Vino Tinto Etiqueta Negra Santa Ana 750 Cc,Bebidas con alcohol,SANTA ANA,750.0 cc,7790762050919
5cbc69be7af152186c0cd752,Vino Tinto Hereford 750 Ml,Bebidas con alcohol,HEREFORD,750.0 ml,7791540035302
5cbc69be7af152186c0cd849,Vino Tinto Malbec Aime 750 Cc,Bebidas con alcohol,AIMÉ,750.0 cc,7798090852533
5cbc69be7af152186c0cd5cb,Vino Tinto Malbec Alaris Trapiche 750 Cc,Bebidas con alcohol,TRAPICHE,750.0 cc,7790240017045
5cbc69be7af152186c0cd5d0,Vino Tinto Malbec Alma Mora 750 Ml,Bebidas con alcohol,ALMA MORA,750.0 ml,7790240042108
5cbc69be7af152186c0cd84d,Vino Tinto Malbec Alta Callia 750 Cc,Bebidas con alcohol,CALLIA,750.0 cc,7798108830751
5cbc69be7af152186c0cd7e2,Vino Tinto Malbec Benjamin Nieto Senetiner 750 Cc,Bebidas con alcohol,NIETO SANETINER,750.0 cc,7793440702940
5cbc69be7af152186c0cd5bd,Vino Tinto Malbec Colon 750 Cc,Bebidas con alcohol,COLON,750.0 cc,7790168114000
5cbc69be7af152186c0cd75a,Vino Tinto Malbec Dada Art 750 Cc,Bebidas con alcohol,DADA,750.0 cc,7791540047862
5cbc69be7af152186c0cd5c0,Vino Tinto Malbec Don David 750 Ml,Bebidas con alcohol,DON DAVID,750.0 ml,7790189001129
5cbc69be7af152186c0cd5c2,Vino Tinto Malbec Elementos 750 Cc,Bebidas con alcohol,ELEMENTOS,750.0 cc,7790189021028
5cbc69be7af152186c0cd7de,Vino Tinto Malbec Emilia Nieto Senetiner 750 Cc,Bebidas con alcohol,NIETO SANETINER,750.0 cc,7793440000305
5cbc69be7af152186c0cd842,Vino Tinto Malbec Finca El Portillo 750 Cc,Bebidas con alcohol,FINCA EL PORTILLO,750.0 cc,7798074860240
5cbc69be7af152186c0cd5d3,Vino Tinto Malbec Finca Las Moras 750 Cc,Bebidas con alcohol,FINCA LAS MORAS,750.0 cc,7790240128598
5cbc69be7af152186c0cd5cd,Vino Tinto Malbec Fond de Cave 750 Cc,Bebidas con alcohol,FOND DE CAVE,750.0 cc,7790240041460
5cbc69be7af152186c0cd843,Vino Tinto Malbec Killka Art & Wine 750 Ml,Bebidas con alcohol,KILLKA,750.0 ml,7798074862077
5cbc69be7af152186c0cd6d0,Vino Tinto Malbec Latitud 33 750 Cc,Bebidas con alcohol,LATITUD 33,750.0 cc,7790975017518
5cbc69be7af152186c0cd5ec,Vino Tinto Malbec Merlot Estancia Mendoza 750 Cc,Bebidas con alcohol,ESTANCIA MENDOZA,750.0 cc,7790314055386
5cbc69be7af152186c0cd7dd,Vino Tinto Malbec Nieto Senetiner 750 Cc,Bebidas con alcohol,NIETO SANETINER,750.0 cc,7793440000046
5cbc69be7af152186c0cd5d1,Vino Tinto Malbec Reserva Trapiche 750 Cc,Bebidas con alcohol,TRAPICHE,750.0 cc,7790240094459
5cbc69be7af152186c0cd833,Vino Tinto Malbec Roble Finca Natalina 750 Cc,Bebidas con alcohol,FINCA NATALINA,750.0 cc,7797942000498
5cbc69be7af152186c0cd762,Vino Tinto Malbec Santa Julia 750 Cc,Bebidas con alcohol,SANTA JULIA,750.0 cc,7791728000160
5cbc69be7af152186c0cd6e1,Vino Tinto Malbec Seleccion Los Arboles 750 Cc,Bebidas con alcohol,LOS ÁRBOLES,750.0 cc,7791250000935
5cbc69be7af152186c0cd6e3,Vino Tinto Malbec Seleccion San Telmo 750 Cc,Bebidas con alcohol,SAN TELMO,750.0 cc,7791250000997
5cbc69be7af152186c0cd5c3,Vino Tinto Seleccion Dorada Michel Torino 380 Cc,Bebidas con alcohol,MICHEL TORINO,380.0 cc,7790189041125
5cbc69be7af152186c0cd67c,Vino Tinto Seleccion Especial Santa Ana 700 Cc,Bebidas con alcohol,SANTA ANA,700.0 cc,7790762052340
5cbc69be7af152186c0cd84b,Vino Tinto Syrah Malbec Callia Alta 750 Ml,Bebidas con alcohol,CALLIA,750.0 ml,7798108830218
5cbc69be7af152186c0cd755,Vino Tinto Vainilla 1 Dada 750 Cc,Bebidas con alcohol,DADA,750.0 cc,7791540044502
5cbc69be7af152186c0cd758,Vino Tinto Varietal Termidor 1 Lt,Bebidas con alcohol,TERMIDOR,1.0 lt,7791540045042
5cbc69be7af152186c0cd75b,Vodka Hiram Walker 1 Lt,Bebidas con alcohol,HIRAM WALKER,1.0 lt,7791560000441
5cbc69be7af152186c0cd6df,Vodka Skyy 750 Cc,Bebidas con alcohol,SKYY,750.0 cc,7791200000213
5cbc69be7af152186c0cd6e5,Vodka Smirnoff 750 Cc,Bebidas con alcohol,SMIRNOFF,750.0 cc,7791250001345
5cbc69be7af152186c0cd6e7,Whisky JyB 750 Cc,Bebidas con alcohol,J&B,750.0 cc,7791250001994
5cbc69be7af152186c0cd850,Whisky Old Smuggler 1 Lt,Bebidas con alcohol,OLD SMUGGLER,1.0 lt,7798131200613
5cbc69be7af152186c0cd6e4,Whisky White Horse 750 Cc,Bebidas con alcohol,WHITE HORSE,750.0 cc,7791250001253
5cbc69be7af152186c0cd768,Agua Saborizada Citrus con Gas H2Oh! 1.5 Lt,Bebidas sin alcohol,H2OH!,1.5 lt,7791813421603
5cbc69be7af152186c0cd76d,Agua Saborizada Citrus con Gas H2Oh! 2.25 Lt,Bebidas sin alcohol,H2OH!,2.25 lt,7791813423591
5cbc69be7af152186c0cd839,Agua Saborizada Citrus con Gas Ser We 2.25 Lt,Bebidas sin alcohol,SER,2.25 lt,7798062541939
5cbc69be7af152186c0cd83a,Agua Saborizada Lemon con Gas We 2.25 Lt,Bebidas sin alcohol,SER,2.25 lt,7798062541946
5cbc69be7af152186c0cd769,Agua Saborizada Limoneto con Gas H2Oh! 1.5 Lt,Bebidas sin alcohol,H2OH!,1.5 lt,7791813421917
5cbc69be7af152186c0cd6b1,Agua Saborizada Manzana sin Gas Aquarius 1.5 Lt,Bebidas sin alcohol,AQUARIUS,1.5 lt,7790895640483
5cbc69be7af152186c0cd68f,Agua Saborizada Manzana sin Gas Aquarius 2.25 Lt,Bebidas sin alcohol,AQUARIUS,2.25 lt,7790895003301
5cbc69be7af152186c0cd69e,Agua Saborizada Manzana sin Gas Aquarius 600 Cc,Bebidas sin alcohol,AQUARIUS,600.0 cc,7790895009211
5cbc69be7af152186c0cd83e,Agua Saborizada Manzana sin Gas Levite 1.5 Lt,Bebidas sin alcohol,LEVITÉ,1.5 lt,7798062548709
5cbc69be7af152186c0cd5f4,Agua Saborizada Manzana sin Gas Levite Cero 1.5 Lt,Bebidas sin alcohol,LEVITÉ,1.5 lt,7790315001061
5cbc69be7af152186c0cd690,Agua Saborizada Naranja Aquarius 2.25 Lt,Bebidas sin alcohol,AQUARIUS,2.25 lt,7790895003325
5cbc69be7af152186c0cd83d,Agua Saborizada Naranja sin Gas Levite 1.5 Lt,Bebidas sin alcohol,LEVITÉ,1.5 lt,7798062548648
5cbc69be7af152186c0cd5f1,Agua Saborizada Naranja sin Gas Levite Cero 1.5 Lt,Bebidas sin alcohol,LEVITÉ,1.5 lt,7790315000934
5cbc69be7af152186c0cd5f3,Agua Saborizada Naranja sin Gas Levite Cero 2.25 Lt,Bebidas sin alcohol,LEVITÉ,2.25 lt,7790315001054
5cbc69be7af152186c0cd836,Agua Saborizada Naranja sin Gas Villa Del Sur Levite 2.25 Lt,Bebidas sin alcohol,LEVITÉ,2.25 lt,7798062540291
5cbc69be7af152186c0cd6b0,Agua Saborizada Pera sin Gas Aquarius 1.5 Lt,Bebidas sin alcohol,AQUARIUS,1.5 lt,7790895640476
5cbc69be7af152186c0cd68e,Agua Saborizada Pera sin Gas Aquarius 2.25 Lt,Bebidas sin alcohol,AQUARIUS,2.25 lt,7790895003295
5cbc69be7af152186c0cd69d,Agua Saborizada Pera sin Gas Aquarius 600 Cc,Bebidas sin alcohol,AQUARIUS,600.0 cc,7790895009204
5cbc69be7af152186c0cd838,Agua Saborizada Pomelo con Gas We 2.2 Lt,Bebidas sin alcohol,SER,2.2 lt,7798062541915
5cbc69be7af152186c0cd6b2,Agua Saborizada Pomelo sin Gas Aquarius 1.5 Lt,Bebidas sin alcohol,AQUARIUS,1.5 lt,7790895640490
5cbc69be7af152186c0cd68d,Agua Saborizada Pomelo sin Gas Aquarius 2.25 Lt,Bebidas sin alcohol,AQUARIUS,2.25 lt,7790895003288
5cbc69be7af152186c0cd69f,Agua Saborizada Pomelo sin Gas Aquarius 600 Cc,Bebidas sin alcohol,AQUARIUS,600.0 cc,7790895009228
5cbc69be7af152186c0cd5f2,Agua Saborizada Pomelo sin Gas Levite Cero 2.25 Lt,Bebidas sin alcohol,LEVITÉ,2.25 lt,7790315001047
5cbc69be7af152186c0cd835,Agua Saborizada Pomelo sin Gas Villa Del Sur Levite 2.25 Lt,Bebidas sin alcohol,LEVITÉ,2.25 lt,7798062540284
5cbc69be7af152186c0cd6c6,Amargo Manzana Cero Terma 1.35 Lt,Bebidas sin alcohol,TERMA,1.35 lt,7790950133370
5cbc69be7af152186c0cd6c2,Aperitivo Amargo Cuyano Terma 1.35 Lt,Bebidas sin alcohol,TERMA,1.35 lt,7790950133332
5cbc69be7af152186c0cd6c3,Aperitivo Amargo Cuyano Terma Light 1.35 Lt,Bebidas sin alcohol,TERMA,1.35 lt,7790950133349
5cbc69be7af152186c0cd6be,Aperitivo Amargo Limon Terma 1.35 Lt,Bebidas sin alcohol,TERMA,1.35 lt,7790950133271
5cbc69be7af152186c0cd6bf,Aperitivo Amargo Limon Terma Light 1.35 Lt,Bebidas sin alcohol,TERMA,1.35 lt,7790950133288
5cbc69be7af152186c0cd6c4,Aperitivo Amargo Patagonico Terma 1.35 Lt,Bebidas sin alcohol,TERMA,1.35 lt,7790950133356
5cbc69be7af152186c0cd6c5,Aperitivo Amargo Pomelo Rosado Terma 1.35 Lt,Bebidas sin alcohol,TERMA,1.35 lt,7790950133363
5cbc69be7af152186c0cd6bd,Aperitivo Amargo Pomelo Terma 1.35 Lt,Bebidas sin alcohol,TERMA,1.35 lt,7790950133257
5cbc69be7af152186c0cd6c0,Aperitivo Amargo Serrano Terma 1.35 Lt,Bebidas sin alcohol,TERMA,1.35 lt,7790950133318
5cbc69be7af152186c0cd6c1,Aperitivo Amargo Serrano Terma Light 1.35 Lt,Bebidas sin alcohol,TERMA,1.35 lt,7790950133325
5cbc69be7af152186c0cd84f,Bebida Energizante Speed Unlimited Regular 250 Ml,Bebidas deportivas,SPEED,250.0 ml,7798119220015
5cbc69be7af152186c0cd781,Bebida Isotonica Cool Blue Gatorade 1.25 Lt,Bebidas deportivas,GATORADE,1.25 lt,7792170110704
5cbc69be7af152186c0cd77c,Bebida Isotonica Cool Blue Gatorade 500 Ml,Bebidas deportivas,GATORADE,500.0 ml,7792170042258
5cbc69be7af152186c0cd695,Bebida Isotonica Frutas Tropicales Powearde 995 Ml,Bebidas deportivas,POWERADE,995.0 ml,7790895006104
5cbc69be7af152186c0cd6b3,Bebida Isotonica Frutas Tropicales Powerade 500 Ml,Bebidas deportivas,POWERADE,500.0 ml,7790895641183
