_id/$oid,nombre,categoria,marca,presentacion,id
5cbc69be7af152186c0cd73c,Yogur Entero Firme Vainilla Yogurisimo 190 Gr,Yogur,YOGURÍSIMO,190.0 gr,7791337601215
5cbc69be7af152186c0cd5aa,Yogur Entero Multivitamina Natural Sancor Yogs 190 Gr,Yogur,YOGS,190.0 gr,7790080065145
5cbc69be7af152186c0cd733,Yogur Frutilla Danonino Pack 2 Un 161 Gr,Yogur,DANONINO,161.0 gr,7791337094024
5cbc69be7af152186c0cd732,Yogur Vainilla Danonino Pack 2 Un 161 Gr,Yogur,DANONINO,161.0 gr,7791337094017
5cbc69be7af152186c0cd585,Risotto 4 Quesos Gallo 200 Gr,Arroz,GALLO,200.0 gr,7790070411754
5cbc69be7af152186c0cd868,Crema de Avellana con Cacao Nutella 140 Gr,,NUTELLA,140.0 gr,7898024395232